{"episodeId":"us-personal-finance/2026-09-fs24-left","channel":"us-personal-finance","currentStage":"integration-fixture","stageStatus":"pending","updatedAt":"2026-09-15T16:03:10.000Z","spendUsd":0,"versions":{"engine":"1.0@git-commit:bd7f0eb5b225ed43d610af12b5febbe82a7dbec4","genre":"1.1@git-tree:ef5389474fc79ed30482f5771076f1e3c3b2ba31","channel":"git-tree:52d17deb20a9ac2c948a0e45ac8b0a9cc7aca8a3"},"revision":3}
